{
  "schema_version": "org.searchright.provider-component-release-signature.v1",
  "component_id": "io.github.edithatogo.searchright.fixture",
  "component_version": "0.1.0",
  "manifest_digest": "1111111111111111111111111111111111111111111111111111111111111111",
  "component_digest": "2222222222222222222222222222222222222222222222222222222222222222",
  "key_id": "fixture-signing-key-1",
  "trust_policy_id": "fixture-provider-component-trust-policy",
  "algorithm": "ed25519",
  "signed_at": "2026-08-14T00:00:00Z",
  "expires_at": "2026-09-14T00:00:00Z",
  "signature": "AAAAAAAAAAAAAAAAAAAAAAAAAAAAAAAAAAAAAAAAAAAAAAAAAAAAAAAAAAAAAAAAAAAAAAAAAAAAAAAAAAAAAA"
}
